community_ID,community_Name,community_Description,creator_ID,,mock event name,mock event description
94,Banks-Morrow in Lake Kimberlychester,A community based in Lake Kimberlychester centred on happen run white.,18,,Profit-focused heuristic alliance Festival,"Experience profit-focused heuristic alliance festival in South James, featuring Student technology people next despite capital huge."
95,Extended 5thgeneration standardization in Kaneton,A community based in Kaneton centred on see admit.,42,,Ergonomic intangible Graphical User Interface Festival,"An annual gathering focused on ergonomic intangible graphical user interface festival in Lake Kristina, featuring Less some manage current if around."
96,Bruce-Lawrence in Amandachester,A community based in Amandachester centred on often.,57,,Team-oriented context-sensitive focus group Festival,"Discover team-oriented context-sensitive focus group festival in Bowmanborough, featuring Also medical lot."
97,Advanced next generation algorithm in Briannaborough,A community based in Briannaborough centred on energy.,83,,Configurable optimal standardization Festival,"Dive into configurable optimal standardization festival in Lake Davidberg, featuring Country happy scientist."
98,Chavez-Ellis in New Stephenhaven,A community based in New Stephenhaven centred on fund one able.,87,,Focused dynamic array Festival,"Celebrate focused dynamic array festival in South Cheyenne, featuring Fly stage share number allow."
99,Extended responsive implementation in Mercerhaven,A community based in Mercerhaven centred on two world.,69,,Exclusive incremental emulation Festival,"Enjoy exclusive incremental emulation festival in North Gregory, featuring List five member which purpose difficult community address."
100,Hernandez-Cunningham in North Donnaside,A community based in North Donnaside centred on hot painting.,61,,Universal demand-driven support Festival,"Bringing together people for universal demand-driven support festival in West Brittanyborough, featuring On as surface try film."
,Self-enabling responsive frame in Suttonbury,A community based in Suttonbury centred on possible budget red.,,,Devolved transitional interface Festival,"A celebration of devolved transitional interface festival in Jennifermouth, featuring Rich cell country clearly."
